Modal run output: - Initializing...
✓ Initialized. View run at 
https://modal.com/apps/bhargav2021/main/ap-ufqSYGaSiaoT2lOmaLRgqr
- Initializing...
- Initializing...

- Creating objects...
\ Creating objects...
/ Creating objects...
\ Creating objects...
└── - Creating mount 
    C:\Users\saket\OneDrive\Desktop\VisonModelFineTuning\app_local_images.py: 
    Uploaded 0/1 files
/ Creating objects...
├── \ Creating mount 
│   C:\Users\saket\OneDrive\Desktop\VisonModelFineTuning\app_local_images.py: 
│   Uploaded 0/1 files
└── -
\ Creating objects...
├── / Creating mount 
│   C:\Users\saket\OneDrive\Desktop\VisonModelFineTuning\app_local_images.py: 
│   Finalizing index of 1 files
└── \ Creating mount 
    C:\Users\saket\OneDrive\Desktop\VisonModelFineTuning\training_images: 
    Uploaded 39/73 files
/ Creating objects...
├── 🔨 Created mount 
│   C:\Users\saket\OneDrive\Desktop\VisonModelFineTuning\app_local_images.py
└── / Creating mount 
    C:\Users\saket\OneDrive\Desktop\VisonModelFineTuning\training_images: 
    Uploaded 120/144 files
\ Creating objects...
├── 🔨 Created mount 
│   C:\Users\saket\OneDrive\Desktop\VisonModelFineTuning\app_local_images.py
└── \ Creating mount 
    C:\Users\saket\OneDrive\Desktop\VisonModelFineTuning\training_images: 
    Finalizing index of 144 files
/ Creating objects...
├── 🔨 Created mount 
│   C:\Users\saket\OneDrive\Desktop\VisonModelFineTuning\app_local_images.py
└── 🔨 Created mount 
    C:\Users\saket\OneDrive\Desktop\VisonModelFineTuning\training_images
\ Creating objects...
├── 🔨 Created mount 
│   C:\Users\saket\OneDrive\Desktop\VisonModelFineTuning\app_local_images.py
├── 🔨 Created mount 
│   C:\Users\saket\OneDrive\Desktop\VisonModelFineTuning\training_images
├── - Creating function download_models...
├── - Creating function train...
├── - Creating function Model.*...
└── - Creating function fastapi_app...
/ Creating objects...
├── 🔨 Created mount 
│   C:\Users\saket\OneDrive\Desktop\VisonModelFineTuning\app_local_images.py
├── 🔨 Created mount 
│   C:\Users\saket\OneDrive\Desktop\VisonModelFineTuning\training_images
├── 🔨 Created function download_models.
├── 🔨 Created function train.
├── 🔨 Created function Model.*.
└── | Creating function fastapi_app...
\ Creating objects...
├── 🔨 Created mount 
│   C:\Users\saket\OneDrive\Desktop\VisonModelFineTuning\app_local_images.py
├── 🔨 Created mount 
│   C:\Users\saket\OneDrive\Desktop\VisonModelFineTuning\training_images
├── 🔨 Created function download_models.
├── 🔨 Created function train.
├── 🔨 Created function Model.*.
└── 🔨 Created web function fastapi_app => 
    https://bhargav2021--romio-plush-marketing-campaign-with-flu-ba86d2-dev.mod
    al.run (label truncated)

✓ Created objects.
├── 🔨 Created mount 
│   C:\Users\saket\OneDrive\Desktop\VisonModelFineTuning\app_local_images.py
├── 🔨 Created mount 
│   C:\Users\saket\OneDrive\Desktop\VisonModelFineTuning\training_images
├── 🔨 Created function download_models.
├── 🔨 Created function train.
├── 🔨 Created function Model.*.
└── 🔨 Created web function fastapi_app => 
    https://bhargav2021--romio-plush-marketing-campaign-with-flu-ba86d2-dev.mod
    al.run (label truncated)
- Running app...
🎨 loading model
- Running app...
\ Running app...
/ Running app...
| Worker assigned... View app at 

The cache for model files in Transformers v4.22.0 has been updated. Migrating your old cache. This is a one-time only operation. You can interrupt this and resume the migration later on by calling `transformers.utils.move_cache()`.
| Running (1/1 containers active)... View app at https://modal.com/apps/bhargav

| Running (1/1 containers active)... View app at https://modal.com/apps/bhargav
[1A0it [00:00, ?it/s]0it [00:00, ?it/s]
| Running (1/1 containers active)... View app at https://modal.com/apps/bhargav
/ Running (1/1 containers active)... View app at 
https://modal.com/apps/bhargav2021/main/ap-ufqSYGaSiaoT2lOmaLRgqr
\ Running (1/1 containers active)... View app at 
https://modal.com/apps/bhargav2021/main/ap-ufqSYGaSiaoT2lOmaLRgqr
/ Running (1/1 containers active)... View app at 
https://modal.com/apps/bhargav2021/main/ap-ufqSYGaSiaoT2lOmaLRgqr
\ Running (1/1 containers active)... View app at 
https://modal.com/apps/bhargav2021/main/ap-ufqSYGaSiaoT2lOmaLRgqr
/ Running (1/1 containers active)... View app at 
https://modal.com/apps/bhargav2021/main/ap-ufqSYGaSiaoT2lOmaLRgqr
\ Running (1/1 containers active)... View app at 
https://modal.com/apps/bhargav2021/main/ap-ufqSYGaSiaoT2lOmaLRgqr
/ Running (1/1 containers active)... View app at 
https://modal.com/apps/bhargav2021/main/ap-ufqSYGaSiaoT2lOmaLRgqr
\ Running (1/1 containers active)... View app at 
https://modal.com/apps/bhargav2021/main/ap-ufqSYGaSiaoT2lOmaLRgqr
/ Running (1/1 containers active)... View app at 
https://modal.com/apps/bhargav2021/main/ap-ufqSYGaSiaoT2lOmaLRgqr
\ Running (1/1 containers active)... View app at 
https://modal.com/apps/bhargav2021/main/ap-ufqSYGaSiaoT2lOmaLRgqr
/ Running (1/1 containers active)... View app at 
https://modal.com/apps/bhargav2021/main/ap-ufqSYGaSiaoT2lOmaLRgqr

/ Running (1/1 containers active)... View app at https://modal.com/apps/bhargav
\ Running (1/1 containers active)... View app at 
https://modal.com/apps/bhargav2021/main/ap-ufqSYGaSiaoT2lOmaLRgqr
[1ALoading pipeline components...:   0%|          | 0/7 [00:00<?, ?it/s]
| Running (1/1 containers active)... View app at https://modal.com/apps/bhargav
/ Running (1/1 containers active)... View app at 
https://modal.com/apps/bhargav2021/main/ap-ufqSYGaSiaoT2lOmaLRgqr
\ Running (1/1 containers active)... View app at 
https://modal.com/apps/bhargav2021/main/ap-ufqSYGaSiaoT2lOmaLRgqr
[1ALoading pipeline components...:  14%|█▁        | 1/7 [00:00<00:02,  2.37it/s]

\ Running (1/1 containers active)... View app at https://modal.com/apps/bhargav
/ Running (1/1 containers active)... View app at 
https://modal.com/apps/bhargav2021/main/ap-ufqSYGaSiaoT2lOmaLRgqr
\ Running (1/1 containers active)... View app at 
https://modal.com/apps/bhargav2021/main/ap-ufqSYGaSiaoT2lOmaLRgqr
/ Running (1/1 containers active)... View app at 
https://modal.com/apps/bhargav2021/main/ap-ufqSYGaSiaoT2lOmaLRgqr
\ Running (1/1 containers active)... View app at 
https://modal.com/apps/bhargav2021/main/ap-ufqSYGaSiaoT2lOmaLRgqr
/ Running (1/1 containers active)... View app at 
https://modal.com/apps/bhargav2021/main/ap-ufqSYGaSiaoT2lOmaLRgqr
\ Running (1/1 containers active)... View app at 
https://modal.com/apps/bhargav2021/main/ap-ufqSYGaSiaoT2lOmaLRgqr
/ Running (1/1 containers active)... View app at 
https://modal.com/apps/bhargav2021/main/ap-ufqSYGaSiaoT2lOmaLRgqr
\ Running (1/1 containers active)... View app at 
https://modal.com/apps/bhargav2021/main/ap-ufqSYGaSiaoT2lOmaLRgqr
/ Running (1/1 containers active)... View app at 
https://modal.com/apps/bhargav2021/main/ap-ufqSYGaSiaoT2lOmaLRgqr
\ Running (1/1 containers active)... View app at 
https://modal.com/apps/bhargav2021/main/ap-ufqSYGaSiaoT2lOmaLRgqr
/ Running (1/1 containers active)... View app at 
https://modal.com/apps/bhargav2021/main/ap-ufqSYGaSiaoT2lOmaLRgqr
\ Running (1/1 containers active)... View app at 
https://modal.com/apps/bhargav2021/main/ap-ufqSYGaSiaoT2lOmaLRgqr
/ Running (1/1 containers active)... View app at 
https://modal.com/apps/bhargav2021/main/ap-ufqSYGaSiaoT2lOmaLRgqr
\ Running (1/1 containers active)... View app at 
https://modal.com/apps/bhargav2021/main/ap-ufqSYGaSiaoT2lOmaLRgqr
/ Running (1/1 containers active)... View app at 
https://modal.com/apps/bhargav2021/main/ap-ufqSYGaSiaoT2lOmaLRgqr
[1ALoading checkpoint shards:   0%|          | 0/2 [00:00<?, ?it/s][A
/ Running (1/1 containers active)... View app at https://modal.com/apps/bhargav

/ Running (1/1 containers active)... View app at https://modal.com/apps/bhargav
\ Running (1/1 containers active)... View app at 
https://modal.com/apps/bhargav2021/main/ap-ufqSYGaSiaoT2lOmaLRgqr
/ Running (1/1 containers active)... View app at 
https://modal.com/apps/bhargav2021/main/ap-ufqSYGaSiaoT2lOmaLRgqr
\ Running (1/1 containers active)... View app at 
https://modal.com/apps/bhargav2021/main/ap-ufqSYGaSiaoT2lOmaLRgqr
/ Running (1/1 containers active)... View app at 
https://modal.com/apps/bhargav2021/main/ap-ufqSYGaSiaoT2lOmaLRgqr
\ Running (1/1 containers active)... View app at 
https://modal.com/apps/bhargav2021/main/ap-ufqSYGaSiaoT2lOmaLRgqr
/ Running (1/1 containers active)... View app at 
https://modal.com/apps/bhargav2021/main/ap-ufqSYGaSiaoT2lOmaLRgqr
\ Running (1/1 containers active)... View app at 
https://modal.com/apps/bhargav2021/main/ap-ufqSYGaSiaoT2lOmaLRgqr
/ Running (1/1 containers active)... View app at 
https://modal.com/apps/bhargav2021/main/ap-ufqSYGaSiaoT2lOmaLRgqr
\ Running (1/1 containers active)... View app at 
https://modal.com/apps/bhargav2021/main/ap-ufqSYGaSiaoT2lOmaLRgqr
/ Running (1/1 containers active)... View app at 
https://modal.com/apps/bhargav2021/main/ap-ufqSYGaSiaoT2lOmaLRgqr
- Running (1/1 containers active)... View app at 
https://modal.com/apps/bhargav2021/main/ap-ufqSYGaSiaoT2lOmaLRgqr
| Running (1/1 containers active)... View app at 
https://modal.com/apps/bhargav2021/main/ap-ufqSYGaSiaoT2lOmaLRgqr
[1ALoading checkpoint shards:  50%|█████     | 1/2 [00:03<00:03,  3.87s/it][A
/ Running (1/1 containers active)... View app at https://modal.com/apps/bhargav
Loading checkpoint shards: 100%|██████████| 2/2 [00:07<00:00,  3.44s/it][ALoading checkpoint shards: 100%|██████████| 2/2 [00:07<00:00,  3.51s/it]

/ Running (1/1 containers active)... View app at https://modal.com/apps/bhargav
[1ALoading pipeline components...:  29%|██▊       | 2/7 [00:07<00:22,  4.50s/it]
- Running (1/1 containers active)... View app at https://modal.com/apps/bhargav
[1ALoading pipeline components...:  43%|████▎     | 3/7 [00:07<00:10,  2.52s/it]You set `add_prefix_space`. The tokenizer needs to be converted from the slow tokenizers
- Running (1/1 containers active)... View app at https://modal.com/apps/bhargav
- Running (1/1 containers active)... View app at 

[1ALoading pipeline components...:  57%|█████▋    | 4/7 [00:08<00:04,  1.60s/it]
\ Running (1/1 containers active)... View app at https://modal.com/apps/bhargav
| Running (1/1 containers active)... View app at 
https://modal.com/apps/bhargav2021/main/ap-ufqSYGaSiaoT2lOmaLRgqr
- Running (1/1 containers active)... View app at 
https://modal.com/apps/bhargav2021/main/ap-ufqSYGaSiaoT2lOmaLRgqr
[1ALoading pipeline components...:  71%|███████▁  | 5/7 [00:16<00:08,  4.00s/it]
- Running (1/1 containers active)... View app at https://modal.com/apps/bhargav
[1ALoading pipeline components...:  86%|████████▌ | 6/7 [00:16<00:02,  2.77s/it]
- Running (1/1 containers active)... View app at https://modal.com/apps/bhargav
[1ALoading pipeline components...: 100%|██████████| 7/7 [00:16<00:00,  2.40s/it]
- Running (1/1 containers active)... View app at https://modal.com/apps/bhargav
🎨 setting up training

Loading checkpoint shards:   0%|          | 0/2 [00:00<?, ?it/s]Loading checkpoint shards:  50%|█████     | 1/2 [00:04<00:04,  4.44s/it]Loading checkpoint shards: 100%|██████████| 2/2 [00:08<00:00,  4.17s/it]Loading checkpoint shards: 100%|██████████| 2/2 [00:08<00:00,  4.21s/it]
/ Running (2/2 containers active)... View app at https://modal.com/apps/bhargav
- Running (2/2 containers active)... View app at 
https://modal.com/apps/bhargav2021/main/ap-ufqSYGaSiaoT2lOmaLRgqr
{'axes_dims_rope'} was not found in config. Values will be initialized to default values.
\ Running (2/2 containers active)... View app at https://modal.com/apps/bhargav

wandb: Currently logged in as: bhargav2021 (bhargav2021-latent-space-solutions). Use `wandb login --relogin` to force relogin
- Running (1/1 containers active)... View app at https://modal.com/apps/bhargav
| Running (1/1 containers active)... View app at 
https://modal.com/apps/bhargav2021/main/ap-ufqSYGaSiaoT2lOmaLRgqr
wandb: wandb version 0.19.11 is available!  To upgrade, please run:
- Running (1/1 containers active)... View app at https://modal.com/apps/bhargav
wandb:  $ pip install wandb --upgrade
wandb: Tracking run with wandb version 0.17.6
wandb: Run data is saved locally in /root/wandb/run-20250526_090636-08jlceej
wandb: Run `wandb offline` to turn off syncing.
wandb: Syncing run fast-river-13
wandb: ⭐️ View project at https://wandb.ai/bhargav2021-latent-space-solutions/dreambooth-flux-dev-lora
wandb: 🚀 View run at https://wandb.ai/bhargav2021-latent-space-solutions/dreambooth-flux-dev-lora/runs/08jlceej
- Running (1/1 containers active)... View app at https://modal.com/apps/bhargav
05/26/2025 09:06:37 - INFO - __main__ - ***** Running training *****
- Running (1/1 containers active)... View app at https://modal.com/apps/bhargav
- Running (1/1 containers active)... View app at 
https://modal.com/apps/bhargav2021/main/ap-ufqSYGaSiaoT2lOmaLRgqr
05/26/2025 09:06:37 - INFO - __main__ -   Num examples = 144
05/26/2025 09:06:37 - INFO - __main__ -   Num batches each epoch = 36
05/26/2025 09:06:37 - INFO - __main__ -   Num Epochs = 7
05/26/2025 09:06:37 - INFO - __main__ -   Instantaneous batch size per device = 4
05/26/2025 09:06:37 - INFO - __main__ -   Total train batch size (w. parallel, distributed & accumulation) = 4
05/26/2025 09:06:37 - INFO - __main__ -   Gradient Accumulation steps = 1
05/26/2025 09:06:37 - INFO - __main__ -   Total optimization steps = 250
 Running (1/1 containers active)... View app at 
https://modal.com/apps/bhargav2021/main/ap-ufqSYGaSiaoT2lOmaLRgqr
Steps:   0%|          | 0/250 [00:00<?, ?it/s]Steps:   0%|          | 1/250 [00:02<08:27,  2.04s/it]Steps:   0%|          | 1/250 [00:02<08:27,  2.04s/it, loss=0.67, lr=5e-5]Steps:   1%|          | 2/250 [00:03<07:25,  1.80s/it, loss=0.67, lr=5e-5]Steps:   1%|          | 2/250 [00:03<07:25,  1.80s/it, loss=0.53, lr=5e-5]Steps:   1%|          | 3/250 [00:05<07:12,  1.75s/it, loss=0.53, lr=5e-5]Steps:   1%|          | 3/250 [00:05<07:12,  1.75s/it, loss=0.522, lr=5e-5]Steps:   2%|▁         | 4/250 [00:07<07:05,  1.73s/it, loss=0.522, lr=5e-5]Steps:   2%|▁         | 4/250 [00:07<07:05,  1.73s/it, loss=0.718, lr=5e-5]Steps:   2%|▁         | 5/250 [00:08<07:01,  1.72s/it, loss=0.718, lr=5e-5]Steps:   2%|▁         | 5/250 [00:08<07:01,  1.72s/it, loss=0.787, lr=5e-5]Steps:   2%|▁         | 6/250 [00:10<06:58,  1.72s/it, loss=0.787, lr=5e-5]Steps:   2%|▁         | 6/250 [00:10<06:58,  1.72s/it, loss=0.709, lr=5e-5]Steps:   3%|▎         | 7/250 [00:12<06:55,  1.71s/it, loss=0.709, lr=5e-5]Steps:   3%|▎         | 7/250 [00:12<06:55,  1.71s/it, loss=0.759, lr=5e-5]Steps:   3%|▎         | 8/250 [00:13<06:53,  1.71s/it, loss=0.759, lr=5e-5]Steps:   3%|▎         | 8/250 [00:13<06:53,  1.71s/it, loss=0.563, lr=5e-5]Steps:   4%|▎         | 9/250 [00:15<06:51,  1.71s/it, loss=0.563, lr=5e-5]Steps:   4%|▎         | 9/250 [00:15<06:51,  1.71s/it, loss=0.733, lr=5e-5]Steps:   4%|▁         | 10/250 [00:17<06:49,  1.71s/it, loss=0.733, lr=5e-5]Steps:   4%|▁         | 10/250 [00:17<06:49,  1.71s/it, loss=0.521, lr=5e-5]Steps:   4%|▁         | 11/250 [00:19<06:48,  1.71s/it, loss=0.521, lr=5e-5]Steps:   4%|▁         | 11/250 [00:19<06:48,  1.71s/it, loss=0.897, lr=5e-5]Steps:   5%|▁         | 12/250 [00:20<06:46,  1.71s/it, loss=0.897, lr=5e-5]Steps:   5%|▁         | 12/250 [00:20<06:46,  1.71s/it, loss=0.655, lr=5e-5]Steps:   5%|▌         | 13/250 [00:22<06:45,  1.71s/it, loss=0.655, lr=5e-5]Steps:   5%|▌         | 13/250 [00:22<06:45,  1.71s/it, loss=0.66, lr=5e-5]
\ Running (1/1 containers active)... View app at https://modal.com/apps/bhargav
[1ASteps:   6%|▌         | 14/250 [00:24<06:43,  1.71s/it, loss=0.66, lr=5e-5]Steps:   6%|▌         | 14/250 [00:24<06:43,  1.71s/it, loss=0.682, lr=5e-5]Steps:   6%|▌         | 15/250 [00:25<06:41,  1.71s/it, loss=0.682, lr=5e-5]Steps:   6%|▌         | 15/250 [00:25<06:41,  1.71s/it, loss=0.678, lr=5e-5]Steps:   6%|▋         | 16/250 [00:27<06:40,  1.71s/it, loss=0.678, lr=5e-5]Steps:   6%|▋         | 16/250 [00:27<06:40,  1.71s/it, loss=0.451, lr=5e-5]Steps:   7%|▋         | 17/250 [00:29<06:38,  1.71s/it, loss=0.451, lr=5e-5]Steps:   7%|▋         | 17/250 [00:29<06:38,  1.71s/it, loss=0.636, lr=5e-5]Steps:   7%|▋         | 18/250 [00:30<06:37,  1.71s/it, loss=0.636, lr=5e-5]Steps:   7%|▋         | 18/250 [00:31<06:37,  1.71s/it, loss=0.51, lr=5e-5] Steps:   8%|▊         | 19/250 [00:32<06:35,  1.71s/it, loss=0.51, lr=5e-5]Steps:   8%|▊         | 19/250 [00:32<06:35,  1.71s/it, loss=0.604, lr=5e-5]Steps:   8%|▊         | 20/250 [00:34<06:34,  1.71s/it, loss=0.604, lr=5e-5]Steps:   8%|▊         | 20/250 [00:34<06:34,  1.71s/it, loss=0.724, lr=5e-5]Steps:   8%|▊         | 21/250 [00:36<06:32,  1.71s/it, loss=0.724, lr=5e-5]Steps:   8%|▊         | 21/250 [00:36<06:32,  1.71s/it, loss=0.672, lr=5e-5]Steps:   9%|▉         | 22/250 [00:37<06:31,  1.72s/it, loss=0.672, lr=5e-5]Steps:   9%|▉         | 22/250 [00:37<06:31,  1.72s/it, loss=0.793, lr=5e-5]Steps:   9%|▉         | 23/250 [00:39<06:29,  1.72s/it, loss=0.793, lr=5e-5]Steps:   9%|▉         | 23/250 [00:39<06:29,  1.72s/it, loss=0.57, lr=5e-5] Steps:  10%|▉         | 24/250 [00:41<06:27,  1.72s/it, loss=0.57, lr=5e-5]Steps:  10%|▉         | 24/250 [00:41<06:27,  1.72s/it, loss=0.713, lr=5e-5]Steps:  10%|█         | 25/250 [00:43<06:26,  1.72s/it, loss=0.713, lr=5e-5]Steps:  10%|█         | 25/250 [00:43<06:26,  1.72s/it, loss=0.455, lr=5e-5]Steps:  10%|█         | 26/250 [00:44<06:24,  1.72s/it, loss=0.455, lr=5e-5]
\ Running (1/1 containers active)... View app at https://modal.com/apps/bhargav
[1ASteps:  10%|█         | 26/250 [00:44<06:24,  1.72s/it, loss=0.512, lr=5e-5]Steps:  11%|█         | 27/250 [00:46<06:23,  1.72s/it, loss=0.512, lr=5e-5]Steps:  11%|█         | 27/250 [00:46<06:23,  1.72s/it, loss=0.464, lr=5e-5]Steps:  11%|█         | 28/250 [00:48<06:21,  1.72s/it, loss=0.464, lr=5e-5]Steps:  11%|█         | 28/250 [00:48<06:21,  1.72s/it, loss=0.491, lr=5e-5]Steps:  12%|█▁        | 29/250 [00:49<06:19,  1.72s/it, loss=0.491, lr=5e-5]Steps:  12%|█▁        | 29/250 [00:49<06:19,  1.72s/it, loss=0.544, lr=5e-5]Steps:  12%|█▁        | 30/250 [00:51<06:18,  1.72s/it, loss=0.544, lr=5e-5]Steps:  12%|█▁        | 30/250 [00:51<06:18,  1.72s/it, loss=0.42, lr=5e-5] Steps:  12%|█▁        | 31/250 [00:53<06:16,  1.72s/it, loss=0.42, lr=5e-5]Steps:  12%|█▁        | 31/250 [00:53<06:16,  1.72s/it, loss=0.447, lr=5e-5]Steps:  13%|█▎        | 32/250 [00:55<06:15,  1.72s/it, loss=0.447, lr=5e-5]Steps:  13%|█▎        | 32/250 [00:55<06:15,  1.72s/it, loss=0.575, lr=5e-5]Steps:  13%|█▎        | 33/250 [00:56<06:13,  1.72s/it, loss=0.575, lr=5e-5]Steps:  13%|█▎        | 33/250 [00:56<06:13,  1.72s/it, loss=0.535, lr=5e-5]Steps:  14%|█▎        | 34/250 [00:58<06:12,  1.72s/it, loss=0.535, lr=5e-5]Steps:  14%|█▎        | 34/250 [00:58<06:12,  1.72s/it, loss=0.546, lr=5e-5]Steps:  14%|█▁        | 35/250 [01:00<06:10,  1.72s/it, loss=0.546, lr=5e-5]Steps:  14%|█▁        | 35/250 [01:00<06:10,  1.72s/it, loss=0.479, lr=5e-5]Steps:  14%|█▁        | 36/250 [01:01<06:08,  1.72s/it, loss=0.479, lr=5e-5]Steps:  14%|█▁        | 36/250 [01:02<06:08,  1.72s/it, loss=0.483, lr=5e-5]Steps:  15%|█▁        | 37/250 [01:03<06:07,  1.73s/it, loss=0.483, lr=5e-5]Steps:  15%|█▁        | 37/250 [01:03<06:07,  1.73s/it, loss=0.71, lr=5e-5] Steps:  15%|█▌        | 38/250 [01:05<06:05,  1.72s/it, loss=0.71, lr=5e-5]Steps:  15%|█▌        | 38/250 [01:05<06:05,  1.72s/it, loss=0.535, lr=5e-5]Steps:  16%|█▌        | 39/250 [01:07<06:03,  1.72s/it, loss=0.535, lr=5e-5]
\ Running (1/1 containers active)... View app at https://modal.com/apps/bhargav
[1ASteps:  16%|█▌        | 39/250 [01:07<06:03,  1.72s/it, loss=0.433, lr=5e-5]Steps:  16%|█▌        | 40/250 [01:08<06:02,  1.73s/it, loss=0.433, lr=5e-5]Steps:  16%|█▌        | 40/250 [01:08<06:02,  1.73s/it, loss=0.463, lr=5e-5]Steps:  16%|█▋        | 41/250 [01:10<06:00,  1.73s/it, loss=0.463, lr=5e-5]Steps:  16%|█▋        | 41/250 [01:10<06:00,  1.73s/it, loss=0.798, lr=5e-5]Steps:  17%|█▋        | 42/250 [01:12<05:58,  1.73s/it, loss=0.798, lr=5e-5]Steps:  17%|█▋        | 42/250 [01:12<05:58,  1.73s/it, loss=0.603, lr=5e-5]Steps:  17%|█▋        | 43/250 [01:14<05:57,  1.73s/it, loss=0.603, lr=5e-5]Steps:  17%|█▋        | 43/250 [01:14<05:57,  1.73s/it, loss=0.437, lr=5e-5]Steps:  18%|█▊        | 44/250 [01:15<05:55,  1.73s/it, loss=0.437, lr=5e-5]Steps:  18%|█▊        | 44/250 [01:15<05:55,  1.73s/it, loss=0.523, lr=5e-5]Steps:  18%|█▊        | 45/250 [01:17<05:53,  1.73s/it, loss=0.523, lr=5e-5]Steps:  18%|█▊        | 45/250 [01:17<05:53,  1.73s/it, loss=0.568, lr=5e-5]Steps:  18%|█▊        | 46/250 [01:19<05:52,  1.73s/it, loss=0.568, lr=5e-5]Steps:  18%|█▊        | 46/250 [01:19<05:52,  1.73s/it, loss=0.693, lr=5e-5]Steps:  19%|█▉        | 47/250 [01:20<05:50,  1.73s/it, loss=0.693, lr=5e-5]Steps:  19%|█▉        | 47/250 [01:21<05:50,  1.73s/it, loss=0.617, lr=5e-5]Steps:  19%|█▉        | 48/250 [01:22<05:48,  1.73s/it, loss=0.617, lr=5e-5]Steps:  19%|█▉        | 48/250 [01:22<05:48,  1.73s/it, loss=0.742, lr=5e-5]Steps:  20%|█▉        | 49/250 [01:24<05:46,  1.73s/it, loss=0.742, lr=5e-5]Steps:  20%|█▉        | 49/250 [01:24<05:46,  1.73s/it, loss=0.692, lr=5e-5]Steps:  20%|██        | 50/250 [01:26<05:45,  1.73s/it, loss=0.692, lr=5e-5]Steps:  20%|██        | 50/250 [01:26<05:45,  1.73s/it, loss=0.571, lr=5e-5]Steps:  20%|██        | 51/250 [01:27<05:43,  1.73s/it, loss=0.571, lr=5e-5]Steps:  20%|██        | 51/250 [01:27<05:43,  1.73s/it, loss=0.436, lr=5e-5]
| Running (1/1 containers active)... View app at https://modal.com/apps/bhargav
[1ASteps:  21%|██        | 52/250 [01:29<05:42,  1.73s/it, loss=0.436, lr=5e-5]Steps:  21%|██        | 52/250 [01:29<05:42,  1.73s/it, loss=0.549, lr=5e-5]Steps:  21%|██        | 53/250 [01:31<05:40,  1.73s/it, loss=0.549, lr=5e-5]Steps:  21%|██        | 53/250 [01:31<05:40,  1.73s/it, loss=0.632, lr=5e-5]Steps:  22%|██▁       | 54/250 [01:33<05:38,  1.73s/it, loss=0.632, lr=5e-5]Steps:  22%|██▁       | 54/250 [01:33<05:38,  1.73s/it, loss=0.482, lr=5e-5]Steps:  22%|██▁       | 55/250 [01:34<05:36,  1.73s/it, loss=0.482, lr=5e-5]Steps:  22%|██▁       | 55/250 [01:34<05:36,  1.73s/it, loss=0.508, lr=5e-5]Steps:  22%|██▁       | 56/250 [01:36<05:35,  1.73s/it, loss=0.508, lr=5e-5]Steps:  22%|██▁       | 56/250 [01:36<05:35,  1.73s/it, loss=0.655, lr=5e-5]Steps:  23%|██▎       | 57/250 [01:38<05:33,  1.73s/it, loss=0.655, lr=5e-5]Steps:  23%|██▎       | 57/250 [01:38<05:33,  1.73s/it, loss=0.52, lr=5e-5] Steps:  23%|██▎       | 58/250 [01:39<05:31,  1.73s/it, loss=0.52, lr=5e-5]Steps:  23%|██▎       | 58/250 [01:40<05:31,  1.73s/it, loss=0.536, lr=5e-5]Steps:  24%|██▎       | 59/250 [01:41<05:29,  1.73s/it, loss=0.536, lr=5e-5]Steps:  24%|██▎       | 59/250 [01:41<05:29,  1.73s/it, loss=0.674, lr=5e-5]Steps:  24%|██▁       | 60/250 [01:43<05:28,  1.73s/it, loss=0.674, lr=5e-5]Steps:  24%|██▁       | 60/250 [01:43<05:28,  1.73s/it, loss=0.439, lr=5e-5]Steps:  24%|██▁       | 61/250 [01:45<05:26,  1.73s/it, loss=0.439, lr=5e-5]Steps:  24%|██▁       | 61/250 [01:45<05:26,  1.73s/it, loss=0.494, lr=5e-5]Steps:  25%|██▁       | 62/250 [01:46<05:25,  1.73s/it, loss=0.494, lr=5e-5]Steps:  25%|██▁       | 62/250 [01:46<05:25,  1.73s/it, loss=0.708, lr=5e-5]Steps:  25%|██▌       | 63/250 [01:48<05:23,  1.73s/it, loss=0.708, lr=5e-5]Steps:  25%|██▌       | 63/250 [01:48<05:23,  1.73s/it, loss=0.491, lr=5e-5]Steps:  26%|██▌       | 64/250 [01:50<05:21,  1.73s/it, loss=0.491, lr=5e-5]
| Running (1/1 containers active)... View app at https://modal.com/apps/bhargav
[1ASteps:  26%|██▌       | 64/250 [01:50<05:21,  1.73s/it, loss=0.542, lr=5e-5]Steps:  26%|██▌       | 65/250 [01:52<05:19,  1.73s/it, loss=0.542, lr=5e-5]Steps:  26%|██▌       | 65/250 [01:52<05:19,  1.73s/it, loss=0.46, lr=5e-5] Steps:  26%|██▋       | 66/250 [01:53<05:18,  1.73s/it, loss=0.46, lr=5e-5]Steps:  26%|██▋       | 66/250 [01:53<05:18,  1.73s/it, loss=0.407, lr=5e-5]Steps:  27%|██▋       | 67/250 [01:55<05:16,  1.73s/it, loss=0.407, lr=5e-5]Steps:  27%|██▋       | 67/250 [01:55<05:16,  1.73s/it, loss=0.379, lr=5e-5]Steps:  27%|██▋       | 68/250 [01:57<05:14,  1.73s/it, loss=0.379, lr=5e-5]Steps:  27%|██▋       | 68/250 [01:57<05:14,  1.73s/it, loss=0.746, lr=5e-5]Steps:  28%|██▊       | 69/250 [01:58<05:12,  1.73s/it, loss=0.746, lr=5e-5]Steps:  28%|██▊       | 69/250 [01:59<05:12,  1.73s/it, loss=0.545, lr=5e-5]Steps:  28%|██▊       | 70/250 [02:00<05:11,  1.73s/it, loss=0.545, lr=5e-5]Steps:  28%|██▊       | 70/250 [02:00<05:11,  1.73s/it, loss=0.632, lr=5e-5]Steps:  28%|██▊       | 71/250 [02:02<05:09,  1.73s/it, loss=0.632, lr=5e-5]Steps:  28%|██▊       | 71/250 [02:02<05:09,  1.73s/it, loss=0.516, lr=5e-5]Steps:  29%|██▉       | 72/250 [02:04<05:07,  1.73s/it, loss=0.516, lr=5e-5]Steps:  29%|██▉       | 72/250 [02:04<05:07,  1.73s/it, loss=0.449, lr=5e-5]Steps:  29%|██▉       | 73/250 [02:05<05:06,  1.73s/it, loss=0.449, lr=5e-5]Steps:  29%|██▉       | 73/250 [02:05<05:06,  1.73s/it, loss=0.371, lr=5e-5]Steps:  30%|██▉       | 74/250 [02:07<05:05,  1.73s/it, loss=0.371, lr=5e-5]Steps:  30%|██▉       | 74/250 [02:07<05:05,  1.73s/it, loss=0.62, lr=5e-5] Steps:  30%|███       | 75/250 [02:09<05:03,  1.73s/it, loss=0.62, lr=5e-5]Steps:  30%|███       | 75/250 [02:09<05:03,  1.73s/it, loss=0.464, lr=5e-5]Steps:  30%|███       | 76/250 [02:11<05:01,  1.73s/it, loss=0.464, lr=5e-5]Steps:  30%|███       | 76/250 [02:11<05:01,  1.73s/it, loss=0.494, lr=5e-5]
| Running (1/1 containers active)... View app at https://modal.com/apps/bhargav
[1ASteps:  31%|███       | 77/250 [02:12<04:59,  1.73s/it, loss=0.494, lr=5e-5]Steps:  31%|███       | 77/250 [02:12<04:59,  1.73s/it, loss=0.644, lr=5e-5]Steps:  31%|███       | 78/250 [02:14<04:57,  1.73s/it, loss=0.644, lr=5e-5]Steps:  31%|███       | 78/250 [02:14<04:57,  1.73s/it, loss=0.44, lr=5e-5] Steps:  32%|███▁      | 79/250 [02:16<04:56,  1.73s/it, loss=0.44, lr=5e-5]Steps:  32%|███▁      | 79/250 [02:16<04:56,  1.73s/it, loss=0.452, lr=5e-5]Steps:  32%|███▁      | 80/250 [02:18<04:54,  1.73s/it, loss=0.452, lr=5e-5]Steps:  32%|███▁      | 80/250 [02:18<04:54,  1.73s/it, loss=0.713, lr=5e-5]Steps:  32%|███▁      | 81/250 [02:19<04:52,  1.73s/it, loss=0.713, lr=5e-5]Steps:  32%|███▁      | 81/250 [02:19<04:52,  1.73s/it, loss=0.598, lr=5e-5]Steps:  33%|███▎      | 82/250 [02:21<04:50,  1.73s/it, loss=0.598, lr=5e-5]Steps:  33%|███▎      | 82/250 [02:21<04:50,  1.73s/it, loss=0.489, lr=5e-5]Steps:  33%|███▎      | 83/250 [02:23<04:49,  1.73s/it, loss=0.489, lr=5e-5]Steps:  33%|███▎      | 83/250 [02:23<04:49,  1.73s/it, loss=0.68, lr=5e-5] Steps:  34%|███▎      | 84/250 [02:24<04:47,  1.73s/it, loss=0.68, lr=5e-5]Steps:  34%|███▎      | 84/250 [02:25<04:47,  1.73s/it, loss=0.412, lr=5e-5]Steps:  34%|███▁      | 85/250 [02:26<04:45,  1.73s/it, loss=0.412, lr=5e-5]Steps:  34%|███▁      | 85/250 [02:26<04:45,  1.73s/it, loss=0.327, lr=5e-5]Steps:  34%|███▁      | 86/250 [02:28<04:43,  1.73s/it, loss=0.327, lr=5e-5]Steps:  34%|███▁      | 86/250 [02:28<04:43,  1.73s/it, loss=0.557, lr=5e-5]Steps:  35%|███▁      | 87/250 [02:30<04:42,  1.73s/it, loss=0.557, lr=5e-5]Steps:  35%|███▁      | 87/250 [02:30<04:42,  1.73s/it, loss=0.396, lr=5e-5]Steps:  35%|███▌      | 88/250 [02:31<04:40,  1.73s/it, loss=0.396, lr=5e-5]Steps:  35%|███▌      | 88/250 [02:31<04:40,  1.73s/it, loss=0.478, lr=5e-5]
| Running (1/1 containers active)... View app at https://modal.com/apps/bhargav
[1ASteps:  36%|███▌      | 89/250 [02:33<04:38,  1.73s/it, loss=0.478, lr=5e-5]Steps:  36%|███▌      | 89/250 [02:33<04:38,  1.73s/it, loss=0.532, lr=5e-5]Steps:  36%|███▌      | 90/250 [02:35<04:36,  1.73s/it, loss=0.532, lr=5e-5]Steps:  36%|███▌      | 90/250 [02:35<04:36,  1.73s/it, loss=0.535, lr=5e-5]Steps:  36%|███▋      | 91/250 [02:37<04:35,  1.73s/it, loss=0.535, lr=5e-5]Steps:  36%|███▋      | 91/250 [02:37<04:35,  1.73s/it, loss=0.396, lr=5e-5]Steps:  37%|███▋      | 92/250 [02:38<04:33,  1.73s/it, loss=0.396, lr=5e-5]Steps:  37%|███▋      | 92/250 [02:38<04:33,  1.73s/it, loss=0.589, lr=5e-5]Steps:  37%|███▋      | 93/250 [02:40<04:31,  1.73s/it, loss=0.589, lr=5e-5]Steps:  37%|███▋      | 93/250 [02:40<04:31,  1.73s/it, loss=0.508, lr=5e-5]Steps:  38%|███▊      | 94/250 [02:42<04:30,  1.73s/it, loss=0.508, lr=5e-5]Steps:  38%|███▊      | 94/250 [02:42<04:30,  1.73s/it, loss=0.424, lr=5e-5]Steps:  38%|███▊      | 95/250 [02:43<04:28,  1.73s/it, loss=0.424, lr=5e-5]Steps:  38%|███▊      | 95/250 [02:44<04:28,  1.73s/it, loss=0.543, lr=5e-5]Steps:  38%|███▊      | 96/250 [02:45<04:26,  1.73s/it, loss=0.543, lr=5e-5]Steps:  38%|███▊      | 96/250 [02:45<04:26,  1.73s/it, loss=0.457, lr=5e-5]Steps:  39%|███▉      | 97/250 [02:47<04:24,  1.73s/it, loss=0.457, lr=5e-5]Steps:  39%|███▉      | 97/250 [02:47<04:24,  1.73s/it, loss=0.509, lr=5e-5]Steps:  39%|███▉      | 98/250 [02:49<04:23,  1.73s/it, loss=0.509, lr=5e-5]Steps:  39%|███▉      | 98/250 [02:49<04:23,  1.73s/it, loss=0.718, lr=5e-5]Steps:  40%|███▉      | 99/250 [02:50<04:21,  1.73s/it, loss=0.718, lr=5e-5]Steps:  40%|███▉      | 99/250 [02:50<04:21,  1.73s/it, loss=0.588, lr=5e-5]Steps:  40%|████      | 100/250 [02:52<04:19,  1.73s/it, loss=0.588, lr=5e-5]Steps:  40%|████      | 100/250 [02:52<04:19,  1.73s/it, loss=0.45, lr=5e-5]
| Running (1/1 containers active)... View app at https://modal.com/apps/bhargav
[1ASteps:  40%|████      | 101/250 [02:54<04:18,  1.73s/it, loss=0.45, lr=5e-5]Steps:  40%|████      | 101/250 [02:54<04:18,  1.73s/it, loss=0.525, lr=5e-5]Steps:  41%|████      | 102/250 [02:56<04:16,  1.73s/it, loss=0.525, lr=5e-5]Steps:  41%|████      | 102/250 [02:56<04:16,  1.73s/it, loss=0.446, lr=5e-5]Steps:  41%|████      | 103/250 [02:57<04:14,  1.73s/it, loss=0.446, lr=5e-5]Steps:  41%|████      | 103/250 [02:57<04:14,  1.73s/it, loss=0.565, lr=5e-5]Steps:  42%|████▁     | 104/250 [02:59<04:12,  1.73s/it, loss=0.565, lr=5e-5]Steps:  42%|████▁     | 104/250 [02:59<04:12,  1.73s/it, loss=0.493, lr=5e-5]Steps:  42%|████▁     | 105/250 [03:01<04:11,  1.73s/it, loss=0.493, lr=5e-5]Steps:  42%|████▁     | 105/250 [03:01<04:11,  1.73s/it, loss=0.411, lr=5e-5]Steps:  42%|████▁     | 106/250 [03:03<04:09,  1.73s/it, loss=0.411, lr=5e-5]Steps:  42%|████▁     | 106/250 [03:03<04:09,  1.73s/it, loss=0.433, lr=5e-5]Steps:  43%|████▎     | 107/250 [03:04<04:07,  1.73s/it, loss=0.433, lr=5e-5]Steps:  43%|████▎     | 107/250 [03:04<04:07,  1.73s/it, loss=0.454, lr=5e-5]Steps:  43%|████▎     | 108/250 [03:06<04:05,  1.73s/it, loss=0.454, lr=5e-5]Steps:  43%|████▎     | 108/250 [03:06<04:05,  1.73s/it, loss=0.526, lr=5e-5]Steps:  44%|████▎     | 109/250 [03:08<04:04,  1.74s/it, loss=0.526, lr=5e-5]Steps:  44%|████▎     | 109/250 [03:08<04:04,  1.74s/it, loss=0.517, lr=5e-5]Steps:  44%|████▁     | 110/250 [03:09<04:03,  1.74s/it, loss=0.517, lr=5e-5]Steps:  44%|████▁     | 110/250 [03:10<04:03,  1.74s/it, loss=0.523, lr=5e-5]Steps:  44%|████▁     | 111/250 [03:11<04:01,  1.73s/it, loss=0.523, lr=5e-5]Steps:  44%|████▁     | 111/250 [03:11<04:01,  1.73s/it, loss=0.433, lr=5e-5]Steps:  45%|████▁     | 112/250 [03:13<03:59,  1.73s/it, loss=0.433, lr=5e-5]
| Running (1/1 containers active)... View app at https://modal.com/apps/bhargav
[1ASteps:  45%|████▁     | 112/250 [03:13<03:59,  1.73s/it, loss=0.425, lr=5e-5]Steps:  45%|████▌     | 113/250 [03:15<03:57,  1.73s/it, loss=0.425, lr=5e-5]Steps:  45%|████▌     | 113/250 [03:15<03:57,  1.73s/it, loss=0.466, lr=5e-5]Steps:  46%|████▌     | 114/250 [03:16<03:55,  1.73s/it, loss=0.466, lr=5e-5]Steps:  46%|████▌     | 114/250 [03:16<03:55,  1.73s/it, loss=0.521, lr=5e-5]Steps:  46%|████▌     | 115/250 [03:18<03:53,  1.73s/it, loss=0.521, lr=5e-5]Steps:  46%|████▌     | 115/250 [03:18<03:53,  1.73s/it, loss=0.425, lr=5e-5]Steps:  46%|████▋     | 116/250 [03:20<03:52,  1.73s/it, loss=0.425, lr=5e-5]Steps:  46%|████▋     | 116/250 [03:20<03:52,  1.73s/it, loss=0.617, lr=5e-5]Steps:  47%|████▋     | 117/250 [03:22<03:50,  1.73s/it, loss=0.617, lr=5e-5]Steps:  47%|████▋     | 117/250 [03:22<03:50,  1.73s/it, loss=0.496, lr=5e-5]Steps:  47%|████▋     | 118/250 [03:23<03:48,  1.73s/it, loss=0.496, lr=5e-5]Steps:  47%|████▋     | 118/250 [03:23<03:48,  1.73s/it, loss=0.506, lr=5e-5]Steps:  48%|████▊     | 119/250 [03:25<03:46,  1.73s/it, loss=0.506, lr=5e-5]Steps:  48%|████▊     | 119/250 [03:25<03:46,  1.73s/it, loss=0.517, lr=5e-5]Steps:  48%|████▊     | 120/250 [03:27<03:45,  1.73s/it, loss=0.517, lr=5e-5]Steps:  48%|████▊     | 120/250 [03:27<03:45,  1.73s/it, loss=0.47, lr=5e-5] Steps:  48%|████▊     | 121/250 [03:29<03:43,  1.73s/it, loss=0.47, lr=5e-5]Steps:  48%|████▊     | 121/250 [03:29<03:43,  1.73s/it, loss=0.654, lr=5e-5]Steps:  49%|████▉     | 122/250 [03:30<03:41,  1.73s/it, loss=0.654, lr=5e-5]Steps:  49%|████▉     | 122/250 [03:30<03:41,  1.73s/it, loss=0.455, lr=5e-5]Steps:  49%|████▉     | 123/250 [03:32<03:40,  1.73s/it, loss=0.455, lr=5e-5]Steps:  49%|████▉     | 123/250 [03:32<03:40,  1.73s/it, loss=0.481, lr=5e-5]Steps:  50%|████▉     | 124/250 [03:34<03:38,  1.73s/it, loss=0.481, lr=5e-5]
| Running (1/1 containers active)... View app at https://modal.com/apps/bhargav
[1ASteps:  50%|████▉     | 124/250 [03:34<03:38,  1.73s/it, loss=0.59, lr=5e-5] Steps:  50%|█████     | 125/250 [03:35<03:36,  1.73s/it, loss=0.59, lr=5e-5]Steps:  50%|█████     | 125/250 [03:36<03:36,  1.73s/it, loss=0.535, lr=5e-5]Steps:  50%|█████     | 126/250 [03:37<03:34,  1.73s/it, loss=0.535, lr=5e-5]Steps:  50%|█████     | 126/250 [03:37<03:34,  1.73s/it, loss=0.356, lr=5e-5]Steps:  51%|█████     | 127/250 [03:39<03:33,  1.73s/it, loss=0.356, lr=5e-5]Steps:  51%|█████     | 127/250 [03:39<03:33,  1.73s/it, loss=0.404, lr=5e-5]Steps:  51%|█████     | 128/250 [03:41<03:31,  1.73s/it, loss=0.404, lr=5e-5]Steps:  51%|█████     | 128/250 [03:41<03:31,  1.73s/it, loss=0.491, lr=5e-5]Steps:  52%|█████▁    | 129/250 [03:42<03:29,  1.73s/it, loss=0.491, lr=5e-5]Steps:  52%|█████▁    | 129/250 [03:42<03:29,  1.73s/it, loss=0.58, lr=5e-5] Steps:  52%|█████▁    | 130/250 [03:44<03:27,  1.73s/it, loss=0.58, lr=5e-5]Steps:  52%|█████▁    | 130/250 [03:44<03:27,  1.73s/it, loss=0.548, lr=5e-5]Steps:  52%|█████▁    | 131/250 [03:46<03:26,  1.73s/it, loss=0.548, lr=5e-5]Steps:  52%|█████▁    | 131/250 [03:46<03:26,  1.73s/it, loss=0.463, lr=5e-5]Steps:  53%|█████▎    | 132/250 [03:48<03:24,  1.73s/it, loss=0.463, lr=5e-5]Steps:  53%|█████▎    | 132/250 [03:48<03:24,  1.73s/it, loss=0.5, lr=5e-5]  Steps:  53%|█████▎    | 133/250 [03:49<03:22,  1.73s/it, loss=0.5, lr=5e-5]Steps:  53%|█████▎    | 133/250 [03:49<03:22,  1.73s/it, loss=0.492, lr=5e-5]Steps:  54%|█████▎    | 134/250 [03:51<03:23,  1.75s/it, loss=0.492, lr=5e-5]Steps:  54%|█████▎    | 134/250 [03:51<03:23,  1.75s/it, loss=0.488, lr=5e-5]Steps:  54%|█████▁    | 135/250 [03:53<03:20,  1.75s/it, loss=0.488, lr=5e-5]Steps:  54%|█████▁    | 135/250 [03:53<03:20,  1.75s/it, loss=0.491, lr=5e-5]
| Running (1/1 containers active)... View app at https://modal.com/apps/bhargav
[1ASteps:  54%|█████▁    | 136/250 [03:55<03:18,  1.74s/it, loss=0.491, lr=5e-5]Steps:  54%|█████▁    | 136/250 [03:55<03:18,  1.74s/it, loss=0.518, lr=5e-5]Steps:  55%|█████▁    | 137/250 [03:56<03:16,  1.74s/it, loss=0.518, lr=5e-5]Steps:  55%|█████▁    | 137/250 [03:56<03:16,  1.74s/it, loss=0.71, lr=5e-5] Steps:  55%|█████▌    | 138/250 [03:58<03:14,  1.74s/it, loss=0.71, lr=5e-5]Steps:  55%|█████▌    | 138/250 [03:58<03:14,  1.74s/it, loss=0.553, lr=5e-5]Steps:  56%|█████▌    | 139/250 [04:00<03:12,  1.74s/it, loss=0.553, lr=5e-5]Steps:  56%|█████▌    | 139/250 [04:00<03:12,  1.74s/it, loss=0.618, lr=5e-5]Steps:  56%|█████▌    | 140/250 [04:02<03:10,  1.74s/it, loss=0.618, lr=5e-5]Steps:  56%|█████▌    | 140/250 [04:02<03:10,  1.74s/it, loss=0.525, lr=5e-5]Steps:  56%|█████▋    | 141/250 [04:03<03:09,  1.73s/it, loss=0.525, lr=5e-5]Steps:  56%|█████▋    | 141/250 [04:03<03:09,  1.73s/it, loss=0.537, lr=5e-5]Steps:  57%|█████▋    | 142/250 [04:05<03:07,  1.73s/it, loss=0.537, lr=5e-5]Steps:  57%|█████▋    | 142/250 [04:05<03:07,  1.73s/it, loss=0.468, lr=5e-5]Steps:  57%|█████▋    | 143/250 [04:07<03:05,  1.73s/it, loss=0.468, lr=5e-5]Steps:  57%|█████▋    | 143/250 [04:07<03:05,  1.73s/it, loss=0.463, lr=5e-5]Steps:  58%|█████▊    | 144/250 [04:08<03:03,  1.73s/it, loss=0.463, lr=5e-5]Steps:  58%|█████▊    | 144/250 [04:09<03:03,  1.73s/it, loss=0.437, lr=5e-5]Steps:  58%|█████▊    | 145/250 [04:10<03:02,  1.73s/it, loss=0.437, lr=5e-5]Steps:  58%|█████▊    | 145/250 [04:10<03:02,  1.73s/it, loss=0.588, lr=5e-5]Steps:  58%|█████▊    | 146/250 [04:12<03:00,  1.73s/it, loss=0.588, lr=5e-5]Steps:  58%|█████▊    | 146/250 [04:12<03:00,  1.73s/it, loss=0.577, lr=5e-5]
| Running (1/1 containers active)... View app at https://modal.com/apps/bhargav
[1ASteps:  59%|█████▉    | 147/250 [04:14<02:58,  1.73s/it, loss=0.577, lr=5e-5]Steps:  59%|█████▉    | 147/250 [04:14<02:58,  1.73s/it, loss=0.525, lr=5e-5]Steps:  59%|█████▉    | 148/250 [04:15<02:56,  1.73s/it, loss=0.525, lr=5e-5]Steps:  59%|█████▉    | 148/250 [04:15<02:56,  1.73s/it, loss=0.413, lr=5e-5]Steps:  60%|█████▉    | 149/250 [04:17<02:55,  1.73s/it, loss=0.413, lr=5e-5]Steps:  60%|█████▉    | 149/250 [04:17<02:55,  1.73s/it, loss=0.499, lr=5e-5]Steps:  60%|██████    | 150/250 [04:19<02:53,  1.73s/it, loss=0.499, lr=5e-5]Steps:  60%|██████    | 150/250 [04:19<02:53,  1.73s/it, loss=0.448, lr=5e-5]Steps:  60%|██████    | 151/250 [04:21<02:51,  1.73s/it, loss=0.448, lr=5e-5]Steps:  60%|██████    | 151/250 [04:21<02:51,  1.73s/it, loss=0.565, lr=5e-5]Steps:  61%|██████    | 152/250 [04:22<02:49,  1.73s/it, loss=0.565, lr=5e-5]Steps:  61%|██████    | 152/250 [04:22<02:49,  1.73s/it, loss=0.654, lr=5e-5]Steps:  61%|██████    | 153/250 [04:24<02:48,  1.73s/it, loss=0.654, lr=5e-5]Steps:  61%|██████    | 153/250 [04:24<02:48,  1.73s/it, loss=0.585, lr=5e-5]Steps:  62%|██████▁   | 154/250 [04:26<02:46,  1.73s/it, loss=0.585, lr=5e-5]Steps:  62%|██████▁   | 154/250 [04:26<02:46,  1.73s/it, loss=0.698, lr=5e-5]Steps:  62%|██████▁   | 155/250 [04:28<02:44,  1.73s/it, loss=0.698, lr=5e-5]Steps:  62%|██████▁   | 155/250 [04:28<02:44,  1.73s/it, loss=0.421, lr=5e-5]Steps:  62%|██████▁   | 156/250 [04:29<02:42,  1.73s/it, loss=0.421, lr=5e-5]Steps:  62%|██████▁   | 156/250 [04:29<02:42,  1.73s/it, loss=0.451, lr=5e-5]Steps:  63%|██████▎   | 157/250 [04:31<02:41,  1.73s/it, loss=0.451, lr=5e-5]Steps:  63%|██████▎   | 157/250 [04:31<02:41,  1.73s/it, loss=0.515, lr=5e-5]Steps:  63%|██████▎   | 158/250 [04:33<02:39,  1.73s/it, loss=0.515, lr=5e-5]
| Running (1/1 containers active)... View app at https://modal.com/apps/bhargav
[1ASteps:  63%|██████▎   | 158/250 [04:33<02:39,  1.73s/it, loss=0.564, lr=5e-5]Steps:  64%|██████▎   | 159/250 [04:34<02:37,  1.73s/it, loss=0.564, lr=5e-5]Steps:  64%|██████▎   | 159/250 [04:35<02:37,  1.73s/it, loss=0.526, lr=5e-5]Steps:  64%|██████▁   | 160/250 [04:36<02:36,  1.73s/it, loss=0.526, lr=5e-5]Steps:  64%|██████▁   | 160/250 [04:36<02:36,  1.73s/it, loss=0.515, lr=5e-5]Steps:  64%|██████▁   | 161/250 [04:38<02:34,  1.73s/it, loss=0.515, lr=5e-5]Steps:  64%|██████▁   | 161/250 [04:38<02:34,  1.73s/it, loss=0.504, lr=5e-5]Steps:  65%|██████▁   | 162/250 [04:40<02:32,  1.73s/it, loss=0.504, lr=5e-5]Steps:  65%|██████▁   | 162/250 [04:40<02:32,  1.73s/it, loss=0.559, lr=5e-5]Steps:  65%|██████▌   | 163/250 [04:41<02:30,  1.73s/it, loss=0.559, lr=5e-5]Steps:  65%|██████▌   | 163/250 [04:41<02:30,  1.73s/it, loss=0.406, lr=5e-5]Steps:  66%|██████▌   | 164/250 [04:43<02:29,  1.73s/it, loss=0.406, lr=5e-5]Steps:  66%|██████▌   | 164/250 [04:43<02:29,  1.73s/it, loss=0.519, lr=5e-5]Steps:  66%|██████▌   | 165/250 [04:45<02:27,  1.73s/it, loss=0.519, lr=5e-5]Steps:  66%|██████▌   | 165/250 [04:45<02:27,  1.73s/it, loss=0.563, lr=5e-5]Steps:  66%|██████▋   | 166/250 [04:47<02:25,  1.73s/it, loss=0.563, lr=5e-5]Steps:  66%|██████▋   | 166/250 [04:47<02:25,  1.73s/it, loss=0.467, lr=5e-5]Steps:  67%|██████▋   | 167/250 [04:48<02:23,  1.73s/it, loss=0.467, lr=5e-5]Steps:  67%|██████▋   | 167/250 [04:48<02:23,  1.73s/it, loss=0.492, lr=5e-5]Steps:  67%|██████▋   | 168/250 [04:50<02:22,  1.73s/it, loss=0.492, lr=5e-5]Steps:  67%|██████▋   | 168/250 [04:50<02:22,  1.73s/it, loss=0.66, lr=5e-5] Steps:  68%|██████▊   | 169/250 [04:52<02:20,  1.73s/it, loss=0.66, lr=5e-5]
| Running (1/1 containers active)... View app at https://modal.com/apps/bhargav
[1ASteps:  68%|██████▊   | 169/250 [04:52<02:20,  1.73s/it, loss=0.415, lr=5e-5]Steps:  68%|██████▊   | 170/250 [04:54<02:18,  1.73s/it, loss=0.415, lr=5e-5]Steps:  68%|██████▊   | 170/250 [04:54<02:18,  1.73s/it, loss=0.377, lr=5e-5]Steps:  68%|██████▊   | 171/250 [04:55<02:16,  1.73s/it, loss=0.377, lr=5e-5]Steps:  68%|██████▊   | 171/250 [04:55<02:16,  1.73s/it, loss=0.425, lr=5e-5]Steps:  69%|██████▉   | 172/250 [04:57<02:15,  1.73s/it, loss=0.425, lr=5e-5]Steps:  69%|██████▉   | 172/250 [04:57<02:15,  1.73s/it, loss=0.513, lr=5e-5]Steps:  69%|██████▉   | 173/250 [04:59<02:13,  1.73s/it, loss=0.513, lr=5e-5]Steps:  69%|██████▉   | 173/250 [04:59<02:13,  1.73s/it, loss=0.502, lr=5e-5]Steps:  70%|██████▉   | 174/250 [05:00<02:11,  1.73s/it, loss=0.502, lr=5e-5]Steps:  70%|██████▉   | 174/250 [05:01<02:11,  1.73s/it, loss=0.541, lr=5e-5]Steps:  70%|███████   | 175/250 [05:02<02:09,  1.73s/it, loss=0.541, lr=5e-5]Steps:  70%|███████   | 175/250 [05:02<02:09,  1.73s/it, loss=0.562, lr=5e-5]Steps:  70%|███████   | 176/250 [05:04<02:08,  1.73s/it, loss=0.562, lr=5e-5]Steps:  70%|███████   | 176/250 [05:04<02:08,  1.73s/it, loss=0.539, lr=5e-5]Steps:  71%|███████   | 177/250 [05:06<02:06,  1.73s/it, loss=0.539, lr=5e-5]Steps:  71%|███████   | 177/250 [05:06<02:06,  1.73s/it, loss=0.699, lr=5e-5]Steps:  71%|███████   | 178/250 [05:07<02:04,  1.73s/it, loss=0.699, lr=5e-5]Steps:  71%|███████   | 178/250 [05:07<02:04,  1.73s/it, loss=0.415, lr=5e-5]Steps:  72%|███████▁  | 179/250 [05:09<02:03,  1.73s/it, loss=0.415, lr=5e-5]Steps:  72%|███████▁  | 179/250 [05:09<02:03,  1.73s/it, loss=0.717, lr=5e-5]Steps:  72%|███████▁  | 180/250 [05:11<02:01,  1.73s/it, loss=0.717, lr=5e-5]
| Running (1/1 containers active)... View app at https://modal.com/apps/bhargav
[1ASteps:  72%|███████▁  | 180/250 [05:11<02:01,  1.73s/it, loss=0.511, lr=5e-5]Steps:  72%|███████▁  | 181/250 [05:13<01:59,  1.74s/it, loss=0.511, lr=5e-5]Steps:  72%|███████▁  | 181/250 [05:13<01:59,  1.74s/it, loss=0.474, lr=5e-5]Steps:  73%|███████▎  | 182/250 [05:14<01:57,  1.73s/it, loss=0.474, lr=5e-5]Steps:  73%|███████▎  | 182/250 [05:14<01:57,  1.73s/it, loss=0.469, lr=5e-5]Steps:  73%|███████▎  | 183/250 [05:16<01:56,  1.73s/it, loss=0.469, lr=5e-5]Steps:  73%|███████▎  | 183/250 [05:16<01:56,  1.73s/it, loss=0.483, lr=5e-5]Steps:  74%|███████▎  | 184/250 [05:18<01:54,  1.73s/it, loss=0.483, lr=5e-5]Steps:  74%|███████▎  | 184/250 [05:18<01:54,  1.73s/it, loss=0.572, lr=5e-5]Steps:  74%|███████▁  | 185/250 [05:20<01:52,  1.73s/it, loss=0.572, lr=5e-5]Steps:  74%|███████▁  | 185/250 [05:20<01:52,  1.73s/it, loss=0.525, lr=5e-5]Steps:  74%|███████▁  | 186/250 [05:21<01:50,  1.73s/it, loss=0.525, lr=5e-5]Steps:  74%|███████▁  | 186/250 [05:21<01:50,  1.73s/it, loss=0.579, lr=5e-5]Steps:  75%|███████▁  | 187/250 [05:23<01:49,  1.73s/it, loss=0.579, lr=5e-5]Steps:  75%|███████▁  | 187/250 [05:23<01:49,  1.73s/it, loss=0.44, lr=5e-5] Steps:  75%|███████▌  | 188/250 [05:25<01:47,  1.73s/it, loss=0.44, lr=5e-5]Steps:  75%|███████▌  | 188/250 [05:25<01:47,  1.73s/it, loss=0.353, lr=5e-5]Steps:  76%|███████▌  | 189/250 [05:26<01:45,  1.73s/it, loss=0.353, lr=5e-5]Steps:  76%|███████▌  | 189/250 [05:27<01:45,  1.73s/it, loss=0.536, lr=5e-5]Steps:  76%|███████▌  | 190/250 [05:28<01:43,  1.73s/it, loss=0.536, lr=5e-5]Steps:  76%|███████▌  | 190/250 [05:28<01:43,  1.73s/it, loss=0.416, lr=5e-5]Steps:  76%|███████▋  | 191/250 [05:30<01:42,  1.73s/it, loss=0.416, lr=5e-5]
| Running (1/1 containers active)... View app at https://modal.com/apps/bhargav
[1ASteps:  76%|███████▋  | 191/250 [05:30<01:42,  1.73s/it, loss=0.493, lr=5e-5]Steps:  77%|███████▋  | 192/250 [05:32<01:40,  1.73s/it, loss=0.493, lr=5e-5]Steps:  77%|███████▋  | 192/250 [05:32<01:40,  1.73s/it, loss=0.457, lr=5e-5]Steps:  77%|███████▋  | 193/250 [05:33<01:38,  1.73s/it, loss=0.457, lr=5e-5]Steps:  77%|███████▋  | 193/250 [05:33<01:38,  1.73s/it, loss=0.442, lr=5e-5]Steps:  78%|███████▊  | 194/250 [05:35<01:36,  1.73s/it, loss=0.442, lr=5e-5]Steps:  78%|███████▊  | 194/250 [05:35<01:36,  1.73s/it, loss=0.528, lr=5e-5]Steps:  78%|███████▊  | 195/250 [05:37<01:35,  1.73s/it, loss=0.528, lr=5e-5]Steps:  78%|███████▊  | 195/250 [05:37<01:35,  1.73s/it, loss=0.436, lr=5e-5]Steps:  78%|███████▊  | 196/250 [05:39<01:33,  1.73s/it, loss=0.436, lr=5e-5]Steps:  78%|███████▊  | 196/250 [05:39<01:33,  1.73s/it, loss=0.45, lr=5e-5] Steps:  79%|███████▉  | 197/250 [05:40<01:31,  1.73s/it, loss=0.45, lr=5e-5]Steps:  79%|███████▉  | 197/250 [05:40<01:31,  1.73s/it, loss=0.457, lr=5e-5]Steps:  79%|███████▉  | 198/250 [05:42<01:30,  1.73s/it, loss=0.457, lr=5e-5]Steps:  79%|███████▉  | 198/250 [05:42<01:30,  1.73s/it, loss=0.455, lr=5e-5]Steps:  80%|███████▉  | 199/250 [05:44<01:28,  1.73s/it, loss=0.455, lr=5e-5]Steps:  80%|███████▉  | 199/250 [05:44<01:28,  1.73s/it, loss=0.581, lr=5e-5]Steps:  80%|████████  | 200/250 [05:46<01:26,  1.73s/it, loss=0.581, lr=5e-5]Steps:  80%|████████  | 200/250 [05:46<01:26,  1.73s/it, loss=0.54, lr=5e-5] Steps:  80%|████████  | 201/250 [05:47<01:24,  1.73s/it, loss=0.54, lr=5e-5]Steps:  80%|████████  | 201/250 [05:47<01:24,  1.73s/it, loss=0.482, lr=5e-5]Steps:  81%|████████  | 202/250 [05:49<01:23,  1.73s/it, loss=0.482, lr=5e-5]
| Running (1/1 containers active)... View app at https://modal.com/apps/bhargav
[1ASteps:  81%|████████  | 202/250 [05:49<01:23,  1.73s/it, loss=0.452, lr=5e-5]Steps:  81%|████████  | 203/250 [05:51<01:21,  1.73s/it, loss=0.452, lr=5e-5]Steps:  81%|████████  | 203/250 [05:51<01:21,  1.73s/it, loss=0.565, lr=5e-5]Steps:  82%|████████▁ | 204/250 [05:52<01:19,  1.73s/it, loss=0.565, lr=5e-5]Steps:  82%|████████▁ | 204/250 [05:53<01:19,  1.73s/it, loss=0.49, lr=5e-5] Steps:  82%|████████▁ | 205/250 [05:54<01:17,  1.73s/it, loss=0.49, lr=5e-5]Steps:  82%|████████▁ | 205/250 [05:54<01:17,  1.73s/it, loss=0.505, lr=5e-5]Steps:  82%|████████▁ | 206/250 [05:56<01:16,  1.73s/it, loss=0.505, lr=5e-5]Steps:  82%|████████▁ | 206/250 [05:56<01:16,  1.73s/it, loss=0.582, lr=5e-5]Steps:  83%|████████▎ | 207/250 [05:58<01:14,  1.73s/it, loss=0.582, lr=5e-5]Steps:  83%|████████▎ | 207/250 [05:58<01:14,  1.73s/it, loss=0.51, lr=5e-5] Steps:  83%|████████▎ | 208/250 [05:59<01:12,  1.73s/it, loss=0.51, lr=5e-5]Steps:  83%|████████▎ | 208/250 [05:59<01:12,  1.73s/it, loss=0.717, lr=5e-5]Steps:  84%|████████▎ | 209/250 [06:01<01:10,  1.73s/it, loss=0.717, lr=5e-5]Steps:  84%|████████▎ | 209/250 [06:01<01:10,  1.73s/it, loss=0.676, lr=5e-5]Steps:  84%|████████▁ | 210/250 [06:03<01:09,  1.73s/it, loss=0.676, lr=5e-5]Steps:  84%|████████▁ | 210/250 [06:03<01:09,  1.73s/it, loss=0.466, lr=5e-5]Steps:  84%|████████▁ | 211/250 [06:05<01:07,  1.73s/it, loss=0.466, lr=5e-5]Steps:  84%|████████▁ | 211/250 [06:05<01:07,  1.73s/it, loss=0.516, lr=5e-5]Steps:  85%|████████▁ | 212/250 [06:06<01:05,  1.73s/it, loss=0.516, lr=5e-5]Steps:  85%|████████▁ | 212/250 [06:06<01:05,  1.73s/it, loss=0.423, lr=5e-5]
| Running (1/1 containers active)... View app at https://modal.com/apps/bhargav
[1ASteps:  85%|████████▌ | 213/250 [06:08<01:04,  1.73s/it, loss=0.423, lr=5e-5]Steps:  85%|████████▌ | 213/250 [06:08<01:04,  1.73s/it, loss=0.465, lr=5e-5]Steps:  86%|████████▌ | 214/250 [06:10<01:02,  1.73s/it, loss=0.465, lr=5e-5]Steps:  86%|████████▌ | 214/250 [06:10<01:02,  1.73s/it, loss=0.54, lr=5e-5] Steps:  86%|████████▌ | 215/250 [06:11<01:00,  1.73s/it, loss=0.54, lr=5e-5]Steps:  86%|████████▌ | 215/250 [06:12<01:00,  1.73s/it, loss=0.537, lr=5e-5]Steps:  86%|████████▋ | 216/250 [06:13<00:58,  1.73s/it, loss=0.537, lr=5e-5]Steps:  86%|████████▋ | 216/250 [06:13<00:58,  1.73s/it, loss=0.55, lr=5e-5] Steps:  87%|████████▋ | 217/250 [06:15<00:57,  1.74s/it, loss=0.55, lr=5e-5]Steps:  87%|████████▋ | 217/250 [06:15<00:57,  1.74s/it, loss=0.484, lr=5e-5]Steps:  87%|████████▋ | 218/250 [06:17<00:55,  1.73s/it, loss=0.484, lr=5e-5]Steps:  87%|████████▋ | 218/250 [06:17<00:55,  1.73s/it, loss=0.578, lr=5e-5]Steps:  88%|████████▊ | 219/250 [06:18<00:53,  1.73s/it, loss=0.578, lr=5e-5]Steps:  88%|████████▊ | 219/250 [06:19<00:53,  1.73s/it, loss=0.597, lr=5e-5]Steps:  88%|████████▊ | 220/250 [06:20<00:52,  1.73s/it, loss=0.597, lr=5e-5]Steps:  88%|████████▊ | 220/250 [06:20<00:52,  1.73s/it, loss=0.494, lr=5e-5]Steps:  88%|████████▊ | 221/250 [06:22<00:50,  1.73s/it, loss=0.494, lr=5e-5]Steps:  88%|████████▊ | 221/250 [06:22<00:50,  1.73s/it, loss=0.451, lr=5e-5]Steps:  89%|████████▉ | 222/250 [06:24<00:48,  1.73s/it, loss=0.451, lr=5e-5]Steps:  89%|████████▉ | 222/250 [06:24<00:48,  1.73s/it, loss=0.508, lr=5e-5]Steps:  89%|████████▉ | 223/250 [06:25<00:46,  1.73s/it, loss=0.508, lr=5e-5]Steps:  89%|████████▉ | 223/250 [06:25<00:46,  1.73s/it, loss=0.531, lr=5e-5]
| Running (1/1 containers active)... View app at https://modal.com/apps/bhargav
[1ASteps:  90%|████████▉ | 224/250 [06:27<00:45,  1.73s/it, loss=0.531, lr=5e-5]Steps:  90%|████████▉ | 224/250 [06:27<00:45,  1.73s/it, loss=0.475, lr=5e-5]Steps:  90%|█████████ | 225/250 [06:29<00:43,  1.73s/it, loss=0.475, lr=5e-5]Steps:  90%|█████████ | 225/250 [06:29<00:43,  1.73s/it, loss=0.529, lr=5e-5]Steps:  90%|█████████ | 226/250 [06:31<00:41,  1.73s/it, loss=0.529, lr=5e-5]Steps:  90%|█████████ | 226/250 [06:31<00:41,  1.73s/it, loss=0.454, lr=5e-5]Steps:  91%|█████████ | 227/250 [06:32<00:39,  1.73s/it, loss=0.454, lr=5e-5]Steps:  91%|█████████ | 227/250 [06:32<00:39,  1.73s/it, loss=0.372, lr=5e-5]Steps:  91%|█████████ | 228/250 [06:34<00:38,  1.73s/it, loss=0.372, lr=5e-5]Steps:  91%|█████████ | 228/250 [06:34<00:38,  1.73s/it, loss=0.74, lr=5e-5] Steps:  92%|█████████▁| 229/250 [06:36<00:36,  1.73s/it, loss=0.74, lr=5e-5]Steps:  92%|█████████▁| 229/250 [06:36<00:36,  1.73s/it, loss=0.455, lr=5e-5]Steps:  92%|█████████▁| 230/250 [06:37<00:34,  1.73s/it, loss=0.455, lr=5e-5]Steps:  92%|█████████▁| 230/250 [06:38<00:34,  1.73s/it, loss=0.469, lr=5e-5]Steps:  92%|█████████▁| 231/250 [06:39<00:32,  1.73s/it, loss=0.469, lr=5e-5]Steps:  92%|█████████▁| 231/250 [06:39<00:32,  1.73s/it, loss=0.459, lr=5e-5]Steps:  93%|█████████▎| 232/250 [06:41<00:31,  1.73s/it, loss=0.459, lr=5e-5]Steps:  93%|█████████▎| 232/250 [06:41<00:31,  1.73s/it, loss=0.477, lr=5e-5]Steps:  93%|█████████▎| 233/250 [06:43<00:29,  1.73s/it, loss=0.477, lr=5e-5]Steps:  93%|█████████▎| 233/250 [06:43<00:29,  1.73s/it, loss=0.589, lr=5e-5]Steps:  94%|█████████▎| 234/250 [06:44<00:27,  1.73s/it, loss=0.589, lr=5e-5]
| Running (1/1 containers active)... View app at https://modal.com/apps/bhargav
[1ASteps:  94%|█████████▎| 234/250 [06:45<00:27,  1.73s/it, loss=0.397, lr=5e-5]Steps:  94%|█████████▁| 235/250 [06:46<00:26,  1.73s/it, loss=0.397, lr=5e-5]Steps:  94%|█████████▁| 235/250 [06:46<00:26,  1.73s/it, loss=0.503, lr=5e-5]Steps:  94%|█████████▁| 236/250 [06:48<00:24,  1.73s/it, loss=0.503, lr=5e-5]Steps:  94%|█████████▁| 236/250 [06:48<00:24,  1.73s/it, loss=0.435, lr=5e-5]Steps:  95%|█████████▁| 237/250 [06:50<00:22,  1.73s/it, loss=0.435, lr=5e-5]Steps:  95%|█████████▁| 237/250 [06:50<00:22,  1.73s/it, loss=0.464, lr=5e-5]Steps:  95%|█████████▌| 238/250 [06:51<00:20,  1.73s/it, loss=0.464, lr=5e-5]Steps:  95%|█████████▌| 238/250 [06:51<00:20,  1.73s/it, loss=0.618, lr=5e-5]Steps:  96%|█████████▌| 239/250 [06:53<00:19,  1.73s/it, loss=0.618, lr=5e-5]Steps:  96%|█████████▌| 239/250 [06:53<00:19,  1.73s/it, loss=0.573, lr=5e-5]Steps:  96%|█████████▌| 240/250 [06:55<00:17,  1.73s/it, loss=0.573, lr=5e-5]Steps:  96%|█████████▌| 240/250 [06:55<00:17,  1.73s/it, loss=0.741, lr=5e-5]Steps:  96%|█████████▋| 241/250 [06:57<00:15,  1.73s/it, loss=0.741, lr=5e-5]Steps:  96%|█████████▋| 241/250 [06:57<00:15,  1.73s/it, loss=0.475, lr=5e-5]Steps:  97%|█████████▋| 242/250 [06:58<00:13,  1.73s/it, loss=0.475, lr=5e-5]Steps:  97%|█████████▋| 242/250 [06:58<00:13,  1.73s/it, loss=0.811, lr=5e-5]Steps:  97%|█████████▋| 243/250 [07:00<00:12,  1.73s/it, loss=0.811, lr=5e-5]Steps:  97%|█████████▋| 243/250 [07:00<00:12,  1.73s/it, loss=0.608, lr=5e-5]Steps:  98%|█████████▊| 244/250 [07:02<00:10,  1.73s/it, loss=0.608, lr=5e-5]Steps:  98%|█████████▊| 244/250 [07:02<00:10,  1.73s/it, loss=0.519, lr=5e-5]
| Running (1/1 containers active)... View app at https://modal.com/apps/bhargav
[1ASteps:  98%|█████████▊| 245/250 [07:03<00:08,  1.73s/it, loss=0.519, lr=5e-5]Steps:  98%|█████████▊| 245/250 [07:04<00:08,  1.73s/it, loss=0.589, lr=5e-5]Steps:  98%|█████████▊| 246/250 [07:05<00:06,  1.73s/it, loss=0.589, lr=5e-5]Steps:  98%|█████████▊| 246/250 [07:05<00:06,  1.73s/it, loss=0.526, lr=5e-5]Steps:  99%|█████████▉| 247/250 [07:07<00:05,  1.73s/it, loss=0.526, lr=5e-5]Steps:  99%|█████████▉| 247/250 [07:07<00:05,  1.73s/it, loss=0.432, lr=5e-5]Steps:  99%|█████████▉| 248/250 [07:09<00:03,  1.73s/it, loss=0.432, lr=5e-5]Steps:  99%|█████████▉| 248/250 [07:09<00:03,  1.73s/it, loss=0.496, lr=5e-5]Steps: 100%|█████████▉| 249/250 [07:10<00:01,  1.73s/it, loss=0.496, lr=5e-5]Steps: 100%|█████████▉| 249/250 [07:11<00:01,  1.73s/it, loss=0.441, lr=5e-5]Steps: 100%|██████████| 250/250 [07:12<00:00,  1.73s/it, loss=0.441, lr=5e-5]Steps: 100%|██████████| 250/250 [07:12<00:00,  1.73s/it, loss=0.569, lr=5e-5]Model weights saved in /model/pytorch_lora_weights.safetensors
| Running (1/1 containers active)... View app at https://modal.com/apps/bhargav

| Running (1/1 containers active)... View app at https://modal.com/apps/bhargav
Loading pipeline components...:   0%|          | 0/7 [00:00<?, ?it/s][ALoaded text_encoder as CLIPTextModel from `text_encoder` subfolder of /model.
/ Running (1/1 containers active)... View app at https://modal.com/apps/bhargav

/ Running (1/1 containers active)... View app at https://modal.com/apps/bhargav
/ Running (1/1 containers active)... View app at 
https://modal.com/apps/bhargav2021/main/ap-ufqSYGaSiaoT2lOmaLRgqr
Loading pipeline components...:  14%|█▁        | 1/7 [00:00<00:01,  5.13it/s][A
/ Running (1/1 containers active)... View app at https://modal.com/apps/bhargav

- Running (1/1 containers active)... View app at https://modal.com/apps/bhargav
Loading checkpoint shards:   0%|          | 0/2 [00:00<?, ?it/s][A[A
\ Running (1/1 containers active)... View app at https://modal.com/apps/bhargav
\ Running (1/1 containers active)... View app at 
https://modal.com/apps/bhargav2021/main/ap-ufqSYGaSiaoT2lOmaLRgqr

\ Running (1/1 containers active)... View app at https://modal.com/apps/bhargav
Loading checkpoint shards:  50%|█████     | 1/2 [00:00<00:00,  5.38it/s][A[A
| Running (1/1 containers active)... View app at https://modal.com/apps/bhargav

Loading checkpoint shards: 100%|██████████| 2/2 [00:00<00:00,  5.46it/s][A[ALoading checkpoint shards: 100%|██████████| 2/2 [00:00<00:00,  5.43it/s]
Loaded text_encoder_2 as T5EncoderModel from `text_encoder_2` subfolder of /model.

| Running (1/1 containers active)... View app at https://modal.com/apps/bhargav
Loading pipeline components...:  29%|██▊       | 2/7 [00:00<00:01,  2.72it/s][A{'axes_dims_rope'} was not found in config. Values will be initialized to default values.
/ Running (1/1 containers active)... View app at https://modal.com/apps/bhargav
/ Running (1/1 containers active)... View app at 
https://modal.com/apps/bhargav2021/main/ap-ufqSYGaSiaoT2lOmaLRgqr
\ Running (1/1 containers active)... View app at 
https://modal.com/apps/bhargav2021/main/ap-ufqSYGaSiaoT2lOmaLRgqr
/ Running (1/1 containers active)... View app at 
https://modal.com/apps/bhargav2021/main/ap-ufqSYGaSiaoT2lOmaLRgqr
\ Running (1/1 containers active)... View app at 
https://modal.com/apps/bhargav2021/main/ap-ufqSYGaSiaoT2lOmaLRgqr
Loaded transformer as FluxTransformer2DModel from `transformer` subfolder of /model.
| Running (1/1 containers active)... View app at https://modal.com/apps/bhargav

| Running (1/1 containers active)... View app at https://modal.com/apps/bhargav
Loading pipeline components...:  43%|████▎     | 3/7 [00:01<00:02,  1.53it/s][ALoaded vae as AutoencoderKL from `vae` subfolder of /model.
/ Running (1/1 containers active)... View app at https://modal.com/apps/bhargav
Loaded tokenizer as CLIPTokenizer from `tokenizer` subfolder of /model.
/ Running (1/1 containers active)... View app at https://modal.com/apps/bhargav
/ Running (1/1 containers active)... View app at 
https://modal.com/apps/bhargav2021/main/ap-ufqSYGaSiaoT2lOmaLRgqr

/ Running (1/1 containers active)... View app at https://modal.com/apps/bhargav
Loading pipeline components...:  71%|███████▁  | 5/7 [00:01<00:00,  3.14it/s][ALoaded tokenizer_2 as T5TokenizerFast from `tokenizer_2` subfolder of /model.
- Running (1/1 containers active)... View app at https://modal.com/apps/bhargav

- Running (1/1 containers active)... View app at https://modal.com/apps/bhargav
Loading pipeline components...:  86%|████████▌ | 6/7 [00:01<00:00,  3.61it/s][ALoaded scheduler as FlowMatchEulerDiscreteScheduler from `scheduler` subfolder of /model.
Loading pipeline components...: 100%|██████████| 7/7 [00:01<00:00,  3.54it/s]
- Running (1/1 containers active)... View app at https://modal.com/apps/bhargav
\ Running (1/1 containers active)... View app at 

wandb: - 0.003 MB of 0.011 MB uploadedwandb: \ 0.003 MB of 0.011 MB uploadedwandb: | 0.011 MB of 0.011 MB uploadedwandb:
/ Running (1/1 containers active)... View app at https://modal.com/apps/bhargav
\ Running (1/1 containers active)... View app at 
https://modal.com/apps/bhargav2021/main/ap-ufqSYGaSiaoT2lOmaLRgqr
/ Running (1/1 containers active)... View app at 
https://modal.com/apps/bhargav2021/main/ap-ufqSYGaSiaoT2lOmaLRgqr
\ Running (1/1 containers active)... View app at 
https://modal.com/apps/bhargav2021/main/ap-ufqSYGaSiaoT2lOmaLRgqr
/ Running (1/1 containers active)... View app at 
https://modal.com/apps/bhargav2021/main/ap-ufqSYGaSiaoT2lOmaLRgqr
wandb: 
/ Running (1/1 containers active)... View app at https://modal.com/apps/bhargav
wandb: Run history:
wandb: loss ▃▄▆▆▃▄▂▆▃▃▃▅▁▁▃▂▂▃▅▂▂▂▃▁▆▃▂▃▃▄▂▂▂▂▄▂▂▁█▂
wandb:   lr ▁▁▁▁▁▁▁▁▁▁▁▁▁▁▁▁▁▁▁▁▁▁▁▁▁▁▁▁▁▁▁▁▁▁▁▁▁▁▁▁
wandb: 
wandb: Run summary:
wandb: loss 0.56915
wandb:   lr 5e-05
wandb: 
wandb: 🚀 View run fast-river-13 at: https://wandb.ai/bhargav2021-latent-space-solutions/dreambooth-flux-dev-lora/runs/08jlceej
wandb: ⭐️ View project at: https://wandb.ai/bhargav2021-latent-space-solutions/dreambooth-flux-dev-lora
wandb: Synced 5 W&B file(s), 0 media file(s), 0 artifact file(s) and 0 other file(s)
wandb: Find logs at: ./wandb/run-20250526_090636-08jlceej/logs
wandb: WARNING The new W&B backend becomes opt-out in version 0.18.0; try it out with `wandb.require("core")`! See https://wandb.me/wandb-core for more information.
/ Running (1/1 containers active)... View app at https://modal.com/apps/bhargav
/usr/local/lib/python3.10/site-packages/wandb/sdk/wandb_run.py:2333: UserWarning: Run (08jlceej) is finished. The call to `_console_raw_callback` will be ignored. Please make sure that you are using an active run.
- Running (1/1 containers active)... View app at https://modal.com/apps/bhargav
  lambda data: self._console_raw_callback("stderr", data),
- Running (1/1 containers active)... View app at https://modal.com/apps/bhargav
Steps: 100%|██████████| 250/250 [07:18<00:00,  1.76s/it, loss=0.569, lr=5e-5]
- Running (1/1 containers active)... View app at https://modal.com/apps/bhargav
\ Running (1/1 containers active)... View app at 
https://modal.com/apps/bhargav2021/main/ap-ufqSYGaSiaoT2lOmaLRgqr

Stopping app - local entrypoint completed.
Runner terminated.
✓ App completed. View run at 
https://modal.com/apps/bhargav2021/main/ap-ufqSYGaSiaoT2lOmaLRgqr